KEY^J,KeyCorp Depositary Shares each representing a 1/40th ownership interest in a share of Fixed Rate Perpetual Non-Cumulative Preferred Stock Series F
KEY^K,KeyCorp Depositary Shares each representing a 1/40th ownership interest in a share of Fixed Rate Perpetual Non-Cumulative Preferred Stock Series G
KEY^L,KeyCorp Depositary Shares each representing a 1/40th ownership interest in a share of Fixed Rate Perpetual Non-Cumulative Preferred Stock Series H
KEY^I,KeyCorp Depositary Shares Each Representing a 1/40th Ownership Interest in a Share of Fixed-to-Floating Rate Perpetual Non-Cumulative Preferred Stock Series E
KEYS,Keysight Technologies Inc. Common Stock
KZR,Kezar Life Sciences Inc. Common Stock
KFRC,Kforce Inc. Common Stock
KVSA,Khosla Ventures Acquisition Co. Class A Common Stock
KVSC,Khosla Ventures Acquisition Co. III Class A Common Stock
PIK,Kidpik Corp. Common Stock
KRC,Kilroy Realty Corporation Common Stock
KE,Kimball Electronics Inc. Common Stock
KBAL,Kimball International Inc. Class B Common Stock
KRP,Kimbell Royalty Partners Common Units Representing Limited Partner Interests
TGR,Kimbell Tiger Acquisition Corporation Class A Common Stock
KMB,Kimberly-Clark Corporation Common Stock
KIM,Kimco Realty Corporation (HC) Common Stock
KIM^L,Kimco Realty Corporation Class L Depositary Shares each of which represents a one-one thousandth fractional interest in a share of 5.125% Class L Cumulative Redeemable Preferred Stock liquidation preference $25000.00 per share
KIM^M,Kimco Realty Corporation Class M Depositary Shares each of which represents a one-one thousandth fractional interest in a share of 5.25% Class M Cumulative Redeemable Preferred Stock liquidation preference $25000.00 per share
KMI,Kinder Morgan Inc. Common Stock
KA,Kineta Inc. Common Stock
KNTK,Kinetik Holdings Inc. Class A Common Stock
KC,Kingsoft Cloud Holdings Limited American Depositary Shares
KINS,Kingstone Companies Inc. Common Stock
KFS,Kingsway Financial Services Inc. Common Stock (DE)
KNSA,Kiniksa Pharmaceuticals Ltd. Class A Common Stock
KNTE,Kinnate Biopharma Inc. Common Stock
KGC,Kinross Gold Corporation Common Stock
KINZ,KINS Technology Group Inc. Class A Common Stock
KINZW,KINS Technology Group Inc. Warrant
KNSL,Kinsale Capital Group Inc. Common Stock
KTRA,Kintara Therapeutics Inc. Common Stock
KPRX,Kiora Pharmaceuticals Inc.  Common Stock
KEX,Kirby Corporation Common Stock
KIRK,Kirkland's Inc. COMMONSTOCK
KRBP,Kiromic BioPharma Inc. Common Stock
KRG,Kite Realty Group Trust Common Stock
KKR^C,KKR & Co. Inc. 6.00% Series C Mandatory Convertible Preferred Stock
KKR,KKR & Co. Inc. Common Stock
KKRS,KKR Group Finance Co. IX LLC 4.625% Subordinated Notes due 2061
KIO,KKR Income Opportunities Fund Common Shares
KREF^A,KKR Real Estate Finance Trust Inc. 6.50% Series A Cumulative Redeemable Preferred Stock
KREF,KKR Real Estate Finance Trust Inc. Common Stock
KLAC,KLA Corporation Common Stock
INKA,KludeIn I Acquisition Corp. Class A Common Stock
KLXE,KLX Energy Services Holdings Inc. Common Stock
KNX,Knight-Swift Transportation Holdings Inc.
KSCP,Knightscope Inc. Class A Common Stock
KNSW,KnightSwan Acquisition Corporation Class A Common Stock
KNOP,KNOT Offshore Partners LP Common Units representing Limited Partner Interests
KNW,Know Labs Inc. Common Stock
KN,Knowles Corporation Common Stock
KOD,Kodiak Sciences Inc Common Stock
KSS,Kohl's Corporation Common Stock
PHG,Koninklijke Philips N.V. NY Registry Shares
KTB,Kontoor Brands Inc. Common Stock 
KOPN,Kopin Corporation Common Stock
KOP,Koppers Holdings Inc. Koppers Holdings Inc. Common Stock
KORE,KORE Group Holdings Inc. Common Stock
KEP,Korea Electric Power Corporation Common Stock
KF,Korea Fund Inc. (The) New Common Stock
KFY,Korn Ferry Common Stock
KRNT,Kornit Digital Ltd. Ordinary Shares
KRMD,KORU Medical Systems Inc. Common Stock
KOS,Kosmos Energy Ltd. Common Shares (DE)
KOSS,Koss Corporation Common Stock
KTOS,Kratos Defense & Security Solutions Inc. Common Stock
DNUT,Krispy Kreme Inc. Common Stock
KR,Kroger Company (The) Common Stock
KRON,Kronos Bio Inc. Common Stock
KRO,Kronos Worldwide Inc Common Stock
KRYS,Krystal Biotech Inc. Common Stock
KT,KT Corporation Common Stock
KBNT,Kubient Inc. Common Stock
KUKE,Kuke Music Holding Limited American Depositary Shares each representing one Ordinary Share
KLIC,Kulicke and Soffa Industries Inc. Common Stock
KULR,KULR Technology Group Inc. Common Stock
KURA,Kura Oncology Inc. Common Stock
KRUS,Kura Sushi USA Inc. Class A Common Stock
KVHI,KVH Industries Inc. Common Stock
KWE,KWESST Micro Systems Inc. Common Stock
KWESW,KWESST Micro Systems Inc. Warrant
KYMR,Kymera Therapeutics Inc. Common Stock
KD,Kyndryl Holdings Inc. Common Stock
LCAA,L Catterton Asia Acquisition Corp Class A Ordinary Shares
LCAAU,L Catterton Asia Acquisition Corp Units
LCAAW,L Catterton Asia Acquisition Corp Warrant
FSTR,L.B. Foster Company Common Stock
SCX,L.S. Starrett Company (The) Common Stock
LHX,L3Harris Technologies Inc. Common Stock
LZB,La-Z-Boy Incorporated Common Stock
LH,Laboratory Corporation of America Holdings Common Stock
LADR,Ladder Capital Corp Class A Common Stock
LSF,Laird Superfood Inc. Common Stock
LSBK,Lake Shore Bancorp Inc. Common Stock
LBAI,Lakeland Bancorp Inc. Common Stock
LKFN,Lakeland Financial Corporation Common Stock
LAKE,Lakeland Industries Inc. Common Stock
LBBB,Lakeshore Acquisition II Corp. Ordinary Shares
LBBBW,Lakeshore Acquisition II Corp. Warrants
LRCX,Lam Research Corporation Common Stock
LAMR,Lamar Advertising Company Class A Common Stock
LW,Lamb Weston Holdings Inc. Common Stock 
LGVC,LAMF Global Ventures Corp. I Class A Ordinary Shares
LGVCU,LAMF Global Ventures Corp. I Unit
LGVCW,LAMF Global Ventures Corp. I Warrant
LANC,Lancaster Colony Corporation Common Stock
LCA,Landcadia Holdings IV Inc. Class A Common Stock
LARK,Landmark Bancorp Inc. Common Stock
LABP,Landos Biopharma Inc. Common Stock
LE,Lands' End Inc. Common Stock
LSEA,Landsea Homes Corporation Common Stock
LSEAW,Landsea Homes Corporation Warrant
LSTR,Landstar System Inc. Common Stock
LCI,Lannett Co Inc Common Stock
LTRN,Lantern Pharma Inc. Common Stock
LNTH,Lantheus Holdings Inc. Common Stock
LTRX,Lantronix Inc. Common Stock
LANV,Lanvin Group Holdings Limited Ordinary Shares
LNZA,LanzaTech Global Inc. Common Stock
LNZAW,LanzaTech Global Inc. Warrant
LGO,Largo Inc. Common Shares
LRMR,Larimar Therapeutics Inc. Common Stock
LVS,Las Vegas Sands Corp. Common Stock
LASE,Laser Photonics Corporation Common Stock
LATG,LatAmGrowth SPAC Class A Ordinary Shares
LATGU,LatAmGrowth SPAC Unit
LATGW,LatAmGrowth SPAC Warrants
LTCH,Latch Inc. Common Stock
LTCHW,Latch Inc. Warrant expiring 6/4/2026
SWIM,Latham Group Inc. Common Stock
LSCC,Lattice Semiconductor Corporation Common Stock
LAUR,Laureate Education Inc. Common Stock
LVAC,LAVA Medtech Acquisition Corp. Class A Common Stock
LVACW,LAVA Medtech Acquisition Corp. Warrants
LVTX,LAVA Therapeutics N.V. Ordinary Shares
LVRO,Lavoro Limited Class A Ordinary Shares
LVROW,Lavoro Limited Warrant
LGI,Lazard Global Total Return and Income Fund Common Stock
LAZ,Lazard LTD. Lazard LTD. Class A Common Stock
LAZY,Lazydays Holdings Inc. Common Stock
LCII,LCI Industries
LCNB,LCNB Corporation Common Stock
LDHA,LDH Growth Corp I Class A Ordinary Shares
LDHAU,LDH Growth Corp I Units
LDHAW,LDH Growth Corp I Warrant
LEGA,Lead Edge Growth Opportunities Ltd Class A Ordinary Shares
LEGAU,Lead Edge Growth Opportunities Ltd Units
LEGAW,Lead Edge Growth Opportunities Ltd Warrant
LFLY,Leafly Holdings Inc. Common Stock
LFLYW,Leafly Holdings Inc. Warrant
LPTX,Leap Therapeutics Inc. Common Stock
LEA,Lear Corporation Common Stock
LCW,Learn CW Investment Corporation Class A Ordinary Shares
LEE,Lee Enterprises Incorporated Common Stock
LEGH,Legacy Housing Corporation Common Stock (TX)
LZ,LegalZoom.com Inc. Common Stock
LEGN,Legend Biotech Corporation American Depositary Shares
LEG,Leggett & Platt Incorporated Common Stock
JBK,Lehman ABS 3.50 3.50% Adjustable Corp Backed Tr Certs GS Cap I
LDOS,Leidos Holdings Inc. Common Stock
LEJU,Leju Holdings Limited American Depositary Shares each representing one Ordinary share
LMAT,LeMaitre Vascular Inc. Common Stock
LMND,Lemonade Inc. Common Stock
LC,LendingClub Corporation Common Stock
TREE,LendingTree Inc. Common Stock
LEN,Lennar Corporation Class A Common Stock
LII,Lennox International Inc. Common Stock
LNSR,LENSAR Inc. Common Stock
LHC,Leo Holdings Corp. II Class A Ordinary Shares
DRS,Leonardo DRS Inc. Common Stock
LSAK,Lesaka Technologies Inc. Common Stock
LESL,Leslie's Inc. Common Stock
LVRA,Levere Holdings Corp. Class A Ordinary Shares
LVRAU,Levere Holdings Corp. Unit
LVRAW,Levere Holdings Corp. Warrant
LEVI,Levi Strauss & Co Class A Common Stock
LEXX,Lexaria Bioscience Corp. Common Stock
LEXXW,Lexaria Bioscience Corp. Warrant
LXRX,Lexicon Pharmaceuticals Inc. Common Stock
LX,LexinFintech Holdings Ltd. American Depositary Shares
LFAC,LF Capital Acquisition Corp. II Class A Common Stock
LFACU,LF Capital Acquisition Corp. II Units
LFACW,LF Capital Acquisition Corp. II Warrants
LPL,LG Display Co Ltd AMERICAN DEPOSITORY SHARES
LGIH,LGI Homes Inc. Common Stock
LGL,LGL Group Inc. (The) Common Stock
LI,Li Auto Inc. American Depositary Shares
LICY,Li-Cycle Holdings Corp. Common Shares
LIAN,LianBio American Depositary Shares
USA,Liberty All-Star Equity Fund Common Stock
ASG,Liberty All-Star Growth Fund Inc.
LBRDA,Liberty Broadband Corporation Class A Common Stock
LBRDK,Liberty Broadband Corporation Class C Common Stock
LBRDP,Liberty Broadband Corporation Series A Cumulative Redeemable Preferred Stock
LBRT,Liberty Energy Inc. Class A common stock
LBTYA,Liberty Global plc Class A Ordinary Shares
LBTYB,Liberty Global plc Class B Ordinary Shares
LBTYK,Liberty Global plc Class C Ordinary Shares
LILA,Liberty Latin America Ltd. Class A Common Stock
LILAK,Liberty Latin America Ltd. Class C Common Stock
BATRA,Liberty Media Corporation Series A Liberty Braves Common Stock
FWONA,Liberty Media Corporation Series A Liberty Formula One Common Stock
LSXMA,Liberty Media Corporation Series A Liberty SiriusXM Common Stock
BATRK,Liberty Media Corporation Series C Liberty Braves Common Stock
FWONK,Liberty Media Corporation Series C Liberty Formula One Common Stock
LSXMK,Liberty Media Corporation Series C Liberty SiriusXM Common Stock
LIBY,Liberty Resources Acquisition Corp. Class A Common Stock
LTRPA,Liberty TripAdvisor Holdings Inc. Series A Common Stock
LTRPB,Liberty TripAdvisor Holdings Inc. Series B Common Stock
LICN,Lichen China Limited Class A Ordinary Shares
LSI,Life Storage Inc. Common Stock
LTH,Life Time Group Holdings Inc. Common Stock
LFCR,Lifecore Biomedical Inc. Common Stock
LFMDP,LifeMD Inc. 8.875% Series A Cumulative Perpetual Preferred Stock
LFMD,LifeMD Inc. Common Stock
LFST,LifeStance Health Group Inc. Common Stock
LCUT,Lifetime Brands Inc. Common Stock
LFVN,Lifevantage Corporation Common Stock (Delaware)
LWAY,Lifeway Foods Inc. Common Stock
LGND,Ligand Pharmaceuticals Incorporated Common Stock
LNW,Light & Wonder Inc. Common Stock
LTBR,Lightbridge Corporation Common Stock
LITB,LightInTheBox Holding Co. Ltd. American Depositary Shares each representing 2 ordinary shares
ZEV,Lightning eMotors Inc Common Stock
LPTH,LightPath Technologies Inc. Class A Common Stock
LSPD,Lightspeed Commerce Inc. Subordinate Voting Shares
LWLG,Lightwave Logic Inc. Common Stock
LILM,Lilium N.V. Class A Ordinary Shares
LILMW,Lilium N.V. Warrants
LMB,Limbach Holdings Inc. Common Stock
LMST,Limestone Bancorp Inc. Common Stock
LMNL,Liminal BioSciences Inc. Common Shares
LMNR,Limoneira Co Common Stock
LINC,Lincoln Educational Services Corporation Common Stock
LECO,Lincoln Electric Holdings Inc. Common Shares
LNC,Lincoln National Corporation Common Stock
LNC^D,Lincoln National Corporation Depositary Shares Each Representing a 1/1000th Interest in a Share of 9.000% Non-Cumulative Preferred Stock Series D
LIND,Lindblad Expeditions Holdings Inc. Common Stock
LIN,Linde plc Ordinary Shares
LNN,Lindsay Corporation Common Stock
LCTX,Lineage Cell Therapeutics Inc. Common Stock
LNKB,LINKBANCORP Inc. Common Stock
LGHL,Lion Group Holding Ltd. American Depositary Share
LGHLW,Lion Group Holding Ltd. Warrant
LION,Lionheart III Corp Class A Common Stock
LIONU,Lionheart III Corp Unit
LIONW,Lionheart III Corp Warrant
LIPO,Lipella Pharmaceuticals Inc. Common Stock
LPCN,Lipocine Inc. Common Stock
LIQT,LiqTech International Inc. Common Stock
YVR,Liquid Media Group Ltd. Common Shares
LQDA,Liquidia Corporation Common Stock
LQDT,Liquidity Services Inc. Common Stock
LSTA,Lisata Therapeutics Inc. Common Stock
LAD,Lithia Motors Inc. Common Stock
LAC,Lithium Americas Corp. Common Shares
LFUS,Littelfuse Inc. Common Stock
LIVB,LIV Capital Acquisition Corp. II Class A Ordinary Shares
LIVN,LivaNova PLC Ordinary Shares
LYV,Live Nation Entertainment Inc. Common Stock
LOB,Live Oak Bancshares Inc. Common Stock
LOCC,Live Oak Crestview Climate Acquisition Corp. Class A Common Stock
LOKM,Live Oak Mobility Acquisition Corp. Class A Common Stock
LIVE,Live Ventures Incorporated Common Stock
LTHM,Livent Corporation Common Stock
LVO,LiveOne Inc. Common Stock
LPSN,LivePerson Inc. Common Stock
RAMP,LiveRamp Holdings Inc. Common Stock
LVOX,LiveVox Holdings Inc. Class A Common Stock
LVOXW,LiveVox Holdings Inc. Warrant
LVWR,LiveWire Group Inc. Common Stock
LXEH,Lixiang Education Holding Co. Ltd. American Depositary Shares
LIXT,Lixte Biotechnology Holdings Inc. Common Stock
LIXTW,Lixte Biotechnology Holdings Inc. Warrants
LIZI,LIZHI INC. American Depositary Shares
LKQ,LKQ Corporation Common Stock
LL,LL Flooring Holdings Inc. Common Stock
LYG,Lloyds Banking Group Plc American Depositary Shares
LMFA,LM Funding America Inc. Common Stock
SCD,LMP Capital and Income Fund Inc. Common Stock
LDI,loanDepot Inc. Class A Common Stock
LCFY,Locafy Limited Ordinary Share
LCFYW,Locafy Limited Warrant
LOCL,Local Bounti Corporation Common Stock
LMT,Lockheed Martin Corporation Common Stock
L,Loews Corporation Common Stock
LRFC,Logan Ridge Finance Corporation Common Stock
LGMK,LogicMark Inc. Common Stock
LITT,Logistics Innovation Technologies Corp. Class A Common Stock
LITTU,Logistics Innovation Technologies Corp. Units
LITTW,Logistics Innovation Technologies Corp. Warrant
LOGI,Logitech International S.A. Ordinary Shares
LOMA,Loma Negra Compania Industrial Argentina Sociedad Anonima ADS
LBPH,Longboard Pharmaceuticals Inc. Common Stock
LGVN,Longeveron Inc. Class A Common Stock
LOOP,Loop Industries Inc. Common Stock
LPTV,Loop Media Inc. Common Stock
RIDE,Lordstown Motors Corp. Class A Common Stock
LTRY,Lottery.com Inc. Common Stock
LTRYW,Lottery.com Inc. Warrants
LPX,Louisiana-Pacific Corporation Common Stock
LOW,Lowe's Companies Inc. Common Stock
LYLT,Loyalty Ventures Inc. Common Stock
LPLA,LPL Financial Holdings Inc. Common Stock
LXU,LSB Industries Inc. Common Stock
LYTS,LSI Industries Inc. Common Stock
LTC,LTC Properties Inc. Common Stock
LUCD,Lucid Diagnostics Inc. Common Stock
LCID,Lucid Group Inc. Common Stock
LHDX,Lucira Health Inc. Common Stock
LSDI,Lucy Scientific Discovery Inc. Common Stock
LU,Lufax Holding Ltd American Depositary Shares two of which representing one Ordinary Share
LVLU,Lulu's Fashion Lounge Holdings Inc. Common Stock
LULU,lululemon athletica inc. Common Stock
LUMN,Lumen Technologies Inc. Common Stock
LFT^A,Lument Finance Trust Inc. 7.875% Series A Cumulative Redeemable Preferred Stock
LFT,Lument Finance Trust Inc. Common Stock
LITE,Lumentum Holdings Inc. Common Stock
LAZR,Luminar Technologies Inc.  Class A Common Stock
LMDX,LumiraDx Limited Common Shares
LMDXW,LumiraDx Limited Warrant
LUMO,Lumos Pharma Inc. Common Stock
LUNA,Luna Innovations Incorporated Common Stock
LKCO,Luokung Technology Corp Ordinary Shares
LBC,Luther Burbank Corporation Common Stock
LXFR,Luxfer Holdings PLC Ordinary Shares
LUXH,LuxUrban Hotels Inc. Common Stock
LXP^C,LXP Industrial Trust 6.5% Series C Cumulative Convertible Preferred Stock
LXP,LXP Industrial Trust Common Stock (Maryland REIT)
LYEL,Lyell Immunopharma Inc. Common Stock
LYFT,Lyft Inc. Class A Common Stock
LYB,LyondellBasell Industries NV Ordinary Shares Class A (Netherlands)
LYRA,Lyra Therapeutics Inc. Common Stock
LYT,Lytus Technologies Holdings PTV. Ltd. Common Shares
MTB,M&T Bank Corporation Common Stock
MTB^H,M&T Bank Corporation Perpetual Fixed-to-Floating Rate Non-Cumulative Preferred Stock Series H
MPTI,M-tron Industries Inc. Common Stock
MDC,M.D.C. Holdings Inc. Common Stock
MHO,M/I Homes Inc. Common Stock
MBAC,M3-Brigade Acquisition II Corp. Class A Common Stock
MBSC,M3-Brigade Acquisition III Corp. Class A Common Stock
MCBC,Macatawa Bank Corporation Common Stock
MAC,Macerich Company (The) Common Stock
MTSI,MACOM Technology Solutions Holdings Inc. Common Stock
MFD,Macquarie First Trust Global Common Stock
MGU,Macquarie Global Infrastructure Total Return Fund Inc. Common Stock
MGNX,MacroGenics Inc. Common Stock
M,Macy's Inc Common Stock
MCN,Madison Covered Call & Equity Strategy Fund Common Stock
MSGE,Madison Square Garden Entertainment Corp. Class A Common Stock 
MSGS,Madison Square Garden Sports Corp. Class A Common Stock (New)
MDGL,Madrigal Pharmaceuticals Inc. Common Stock
MAG,MAG Silver Corporation Ordinary Shares
MMP,Magellan Midstream Partners L.P. Limited Partnership
MGTA,Magenta Therapeutics Inc. Common Stock
MEGL,Magic Empire Global Limited Ordinary Shares
MGIC,Magic Software Enterprises Ltd. Ordinary Shares
MGA,Magna International Inc. Common Stock
MX,Magnachip Semiconductor Corporation Common Stock
MGNI,Magnite Inc. Common Stock
MGY,Magnolia Oil & Gas Corporation Class A Common Stock
OPA,Magnum Opus Acquisition Limited Class A Ordinary Shares
MGYR,Magyar Bancorp Inc. Common Stock
MAIA,MAIA Biotechnology Inc. Common Stock
MHLD,Maiden Holdings Ltd.
MHLA,Maiden Holdings Ltd. 6.625% Notes due 2046
MHNC,Maiden Holdings North America Ltd. 7.75% Notes due 2043
MAIN,Main Street Capital Corporation Common Stock
MEGI,MainStay CBRE Global Infrastructure Megatrends Fund Common Shares
MMD,MainStay MacKay DefinedTerm Municipal Opportunities Fund
MNSB,MainStreet Bancshares Inc. Common Stock
MNSBP,MainStreet Bancshares Inc. Depositary Shares
MYNZ,Mainz Biomed N.V. Ordinary Shares
MMYT,MakeMyTrip Limited Ordinary Shares
MLAC,Malacca Straits Acquisition Company Limited Class A Ordinary Shares
MLACW,Malacca Straits Acquisition Company Limited Warrants
MBUU,Malibu Boats Inc. Class A Common Stock
MNK,Mallinckrodt plc Ordinary Shares
MLVF,Malvern Bancorp Inc. Common Stock
MMMB,MamaMancini's Holdings Inc. Common Stock
TUSK,Mammoth Energy Services Inc. Common Stock
MANU,Manchester United Ltd. Class A Ordinary Shares
MANH,Manhattan Associates Inc. Common Stock
LOAN,Manhattan Bridge Capital Inc
MNTX,Manitex International Inc. Common Stock
MTW,Manitowoc Company Inc. (The) Common Stock
MTEX,Mannatech Incorporated Common Stock
MNKD,MannKind Corporation Common Stock
MAN,ManpowerGroup Common Stock
MFC,Manulife Financial Corporation Common Stock
MAQC,Maquia Capital Acquisition Corporation Class A Common Stock
MAQCW,Maquia Capital Acquisition Corporation Warrant
MARA,Marathon Digital Holdings Inc. Common Stock
MRO,Marathon Oil Corporation Common Stock
MPC,Marathon Petroleum Corporation Common Stock
MRVI,Maravai LifeSciences Holdings Inc. Class A Common Stock
GATE,Marblegate Acquisition Corp. Class A Common Stock
GATEU,Marblegate Acquisition Corp. Unit
GATEW,Marblegate Acquisition Corp. Warrant
MCHX,Marchex Inc. Class B Common Stock
MMI,Marcus & Millichap Inc. Common Stock
MCS,Marcus Corporation (The) Common Stock
MRDB,MariaDB plc Ordinary Shares
MRIN,Marin Software Incorporated Common Stock
MARPS,Marine Petroleum Trust Units of Beneficial Interest
MPX,Marine Products Corporation Common Stock
HZO,MarineMax Inc.  (FL) Common Stock
MRNS,Marinus Pharmaceuticals Inc. Common Stock
MTEK,Maris-Tech Ltd. Ordinary Shares
MTEKW,Maris-Tech Ltd. Warrants
MKL,Markel Corporation Common Stock
MRKR,Marker Therapeutics Inc. Common Stock
MKTX,MarketAxess Holdings Inc. Common Stock
MKTW,MarketWise Inc. Class A Common Stock
MKFG,Markforged Holding Corporation Common Stock
MRAI,Marpai Inc. Class A Common Stock
MQ,Marqeta Inc. Class A Common Stock
MAR,Marriott International Class A Common Stock
VAC,Marriott Vacations Worldwide Corporation Common Stock
MARXU,Mars Acquisition Corp. Unit
MMC,Marsh & McLennan Companies Inc. Common Stock
MRTN,Marten Transport Ltd. Common Stock
MLM,Martin Marietta Materials Inc. Common Stock
MMLP,Martin Midstream Partners L.P. Limited Partnership
MRVL,Marvell Technology Inc. Common Stock
MAS,Masco Corporation Common Stock
MASI,Masimo Corporation Common Stock
DOOR,Masonite International Corporation Ordinary Shares (Canada)
MTZ,MasTec Inc. Common Stock
MHH,Mastech Digital Inc Common Stock
MBC,MasterBrand Inc. Common Stock
MA,Mastercard Incorporated Common Stock
MCFT,MasterCraft Boat Holdings Inc. Common Stock
MTDR,Matador Resources Company Common Stock
MTCH,Match Group Inc. Common Stock
MTLS,Materialise NV American Depositary Shares
MTRN,Materion Corporation
MTNB,Matinas Biopharma Holdings Inc. Common Stock
MATV,Mativ Holdings Inc. Common Stock
MTRX,Matrix Service Company Common Stock
MATX,Matson Inc. Common Stock
MAT,Mattel Inc. Common Stock
MTTR,Matterport Inc. Class A Common Stock
MATW,Matthews International Corporation Class A Common Stock
MLP,Maui Land & Pineapple Company Inc. Common Stock
MIGI,Mawson Infrastructure Group Inc. Common Stock
MAXR,Maxar Technologies Inc.
MXCT,MaxCyte Inc. Common Stock
MAXN,Maxeon Solar Technologies Ltd. Ordinary Shares
MMS,Maximus Inc. Common Stock
MXL,MaxLinear Inc. Common Stock
JMAC,Maxpro Capital Acquisition Corp. Class A Common Stock
JMACW,Maxpro Capital Acquisition Corp. Warrants
MEC,Mayville Engineering Company Inc. Common Stock
MBI,MBIA Inc. Common Stock
MKC,McCormick & Company Incorporated Common Stock
MCD,McDonald's Corporation Common Stock
MUX,McEwen Mining Inc. Common Stock
MGRC,McGrath RentCorp Common Stock
MCK,McKesson Corporation Common Stock
MLAI,McLaren Technology Acquisition Corp. Class A Common Stock
MLAIU,McLaren Technology Acquisition Corp. Unit
MLAIW,McLaren Technology Acquisition Corp. Warrant
MCLD,mCloud Technologies Corp. Common Shares
MCLDW,mCloud Technologies Corp. Warrants
MDJH,MDJM LTD Ordinary Share
MDU,MDU Resources Group Inc. Common Stock (Holding Company)
MDXH,MDxHealth SA American Depositary Shares
MDRR,Medalist Diversified REIT Inc. Common Stock
MDRRP,Medalist Diversified REIT Inc. Series A Cumulative Redeemable Preferred Stock
MBNKP,Medallion Bank Fixed-to-Floating Rate Non-Cumulative Perpetual Preferred Stock Series F
MFIN,Medallion Financial Corp. Common Stock
MDVL,MedAvail Holdings Inc. Common Stock
MAX,MediaAlpha Inc. Class A Common Stock
MDIA,Mediaco Holding Inc. Class A Common Stock 
MPW,Medical Properties Trust Inc. common stock
MDNA,Medicenna Therapeutics Corp. Common Shares
MNOV,Medicinova Inc Common Stock
MED,MEDIFAST INC Common Stock
MDGS,Medigus Ltd. American Depositary Shares
MDGSW,Medigus Ltd. Series C Warrant
MRM,MEDIROM Healthcare Technologies Inc. American Depositary Share
MDWD,MediWound Ltd. Ordinary Shares
MEDP,Medpace Holdings Inc. Common Stock
MTAC,MedTech Acquisition Corporation Class A Common Stock
MDT,Medtronic plc. Ordinary Shares
MPU,Mega Matrix Corp. Common Stock
MEIP,MEI Pharma Inc. Common Stock
MHUA,Meihua International Medical Technologies Co. Ltd. Ordinary Shares
MGTX,MeiraGTx Holdings plc Ordinary Shares
WNW,Meiwu Technology Company Limited Ordinary Shares
MLCO,Melco Resorts & Entertainment Limited American Depositary Shares
MEKA,MELI Kaszek Pioneer Corp Class A Ordinary Shares
MCG,Membership Collective Group Inc. Class A Common Stock
MELI,MercadoLibre Inc. Common Stock
MBWM,Mercantile Bank Corporation Common Stock
MPRA,Mercato Partners Acquisition Corporation Class A Common Stock
MPRAU,Mercato Partners Acquisition Corporation Unit
MPRAW,Mercato Partners Acquisition Corporation Warrant
MERC,Mercer International Inc. Common Stock
MBINP,Merchants Bancorp 7.00% Fixed-to-Floating Rate Series A Non-Cumulative Perpetual Preferred Stock
MBIN,Merchants Bancorp Common Stock
MBINM,Merchants Bancorp Depositary Shares Each Representing a 1/40th Interest in a Share of 8.25% Fixed-Rate Reset Series D Non-Cumulative Perpetual Preferred Stock
MBINO,Merchants Bancorp Depositary Shares Each Representing a 1/40th Interest in a Share of Series B  Fixed-to-Floating Rate
MBINN,Merchants Bancorp Depositary Shares Preferred Series C
MRK,Merck & Company Inc. Common Stock (new)
MFH,Mercurity Fintech Holding Inc. Ordinary Shares
MCY,Mercury General Corporation Common Stock
MRCY,Mercury Systems Inc Common Stock
MREO,Mereo BioPharma Group plc American Depositary Shares
MRBK,Meridian Corporation Common Stock
MLNK,MeridianLink Inc. Common Stock
MMSI,Merit Medical Systems Inc. Common Stock
MTH,Meritage Homes Corporation Common Stock
MACK,Merrimack Pharmaceuticals Inc. Common Stock
MRSN,Mersana Therapeutics Inc. Common Stock
MRUS,Merus N.V. Common Shares
MESA,Mesa Air Group Inc. Common Stock
MLAB,Mesa Laboratories Inc. Common Stock
MTR,Mesa Royalty Trust Common Stock
MSB,Mesabi Trust Common Stock
MESO,Mesoblast Limited American Depositary Shares
AIU,Meta Data Limited ADS
MMAT,Meta Materials Inc. Common Stock
META,Meta Platforms Inc. Class A Common Stock
MSSA,Metal Sky Star Acquisition Corporation Ordinary shares
MSSAU,Metal Sky Star Acquisition Corporation Unit
MSSAW,Metal Sky Star Acquisition Corporation Warrant
MTA,Metalla Royalty & Streaming Ltd. Common Shares
MATH,Metalpha Technology Holding Limited Ordinary Shares
MTAL,Metals Acquisition Corp Class A Ordinary Shares
METX,Meten Holding Group Ltd. Ordinary Shares
METXW,Meten Holding Group Ltd. Warrant
MEOH,Methanex Corporation Common Stock
MEI,Methode Electronics Inc. Common Stock
MET,MetLife Inc. Common Stock
MET^F,MetLife Inc. Depositary Shares each representing a 1/1000th interest in a share of 4.75% Non-Cumulative Preferred Stock Series F
